{
  "ai_generated": true,
  "date": "2026-10-14",
  "id": "nightly-2026-10-14",
  "image": {
    "file": "artwork.png",
    "height": 941,
    "sha256": "7810ff6abe9106bfbe7ccbead747f51eab3358d5f653e5091ef28fb14e4844ba",
    "width": 1672
  },
  "kind": "nightly",
  "research": {
    "sources": [
      {
        "label": "Published research",
        "url": "https://doi.org/10.1038/s41467-023-39326-3"
      }
    ],
    "summary": "An Expressionist folded ring imagines daily variation in choroid-plexus protein output, which need not mirror transcript abundance."
  },
  "schema_version": 1,
  "title": "The Hours Inside the Fold"
}
